{"files":[{"contentSchemaRef":{"digest":"104ca12f99dc18fabbc000463c208fe48b41328033a3e4db005d2a00140ca37a","id":"agenttalk.design.spec.v1","version":"1"},"context":{"layer":"shared","retention":"run","roleIds":["architect"],"workspaceAccess":"read_only"},"declaredOwnerRoleId":"pm","format":"json","kind":"plan","path":"plan/spec.json","required":true,"sha256":"e5f1eb4d806641698a35efe20e098efd20d7d57a9b90ee69079d5bb650920726","size":12},{"contentSchemaRef":{"digest":"14e25466af47c8ed847ff4ed5bd7aa8de4bcb19da31453cb709da995dbd6c39e","id":"agenttalk.acceptance.v1","version":"1"},"context":{"layer":"shared","retention":"run","roleIds":["architect","pm"],"workspaceAccess":"read_only"},"declaredOwnerRoleId":"pm","format":"json","kind":"acceptance","path":"acceptance/checklist.json","required":true,"sha256":"b1b367dc6a7d077581f77f16169a6696bac3d68ffd5c93189ac60fac027e57a3","size":18}],"projectId":"golden-brief","roles":[{"displayName":"Architect","roleId":"architect"},{"displayName":"PM","roleId":"pm"}],"schemaVersion":"agenttalk.brief.manifest.v1","title":"Golden Brief"}