{"schemaVersion":"agenttalk.brief.manifest.v1","projectId":"golden-brief","title":"Golden Brief","roles":[{"roleId":"architect","displayName":"Architect"},{"roleId":"pm","displayName":"PM"}],"files":[{"path":"plan/spec.json","kind":"plan","format":"json","contentSchemaRef":{"id":"agenttalk.design.spec.v1","version":"1","digest":"104ca12f99dc18fabbc000463c208fe48b41328033a3e4db005d2a00140ca37a"},"required":true,"sha256":"e5f1eb4d806641698a35efe20e098efd20d7d57a9b90ee69079d5bb650920726","size":12,"context":{"layer":"shared","roleIds":["architect"],"retention":"run","workspaceAccess":"read_only"},"declaredOwnerRoleId":"pm"},{"path":"acceptance/checklist.json","kind":"acceptance","format":"json","contentSchemaRef":{"id":"agenttalk.acceptance.v1","version":"1","digest":"14e25466af47c8ed847ff4ed5bd7aa8de4bcb19da31453cb709da995dbd6c39e"},"required":true,"sha256":"b1b367dc6a7d077581f77f16169a6696bac3d68ffd5c93189ac60fac027e57a3","size":18,"context":{"layer":"shared","roleIds":["architect","pm"],"retention":"run","workspaceAccess":"read_only"},"declaredOwnerRoleId":"pm"}]}
