{"schemaVersion":"agenttalk.brief.manifest.v1","projectId":"golden-brief","title":"Golden Brief","roles":[{"roleId":"pm","displayName":"PM"},{"roleId":"architect","displayName":"Architect"}],"files":[{"path":"design/notes.txt","kind":"design","format":"text","contentSchemaRef":null,"required":true,"sha256":"e32d114b6db46abc5dd006a592fb3726a013324d79fc9b3c208ffe2bb70d925a","size":33,"context":{"layer":"persistent","roleIds":["architect"],"retention":"run","workspaceAccess":"workspace_write"},"declaredOwnerRoleId":"pm"},{"path":"plan/.env.example","kind":"plan","format":"text","contentSchemaRef":null,"required":false,"sha256":"517a25c25f2867975aeae18410d5f8aea5b3ccb479360016fb3c36e00bafe244","size":25,"context":{"layer":"role","roleIds":["pm"],"retention":"project","workspaceAccess":"none"},"declaredOwnerRoleId":"pm"},{"path":"plan/roadmap.md","kind":"plan","format":"markdown","contentSchemaRef":null,"required":true,"sha256":"53313e8cb5128d672c57bce68160d206ee7c8824ef733a6bbe3fa8136e3bec88","size":35,"context":{"layer":"shared","roleIds":["pm","architect"],"retention":"run","workspaceAccess":"read_only"},"declaredOwnerRoleId":"pm"}]}
