{"files":[{"contentSchemaRef":null,"context":{"layer":"shared","retention":"run","roleIds":["architect","pm"],"workspaceAccess":"read_only"},"declaredOwnerRoleId":"pm","format":"markdown","kind":"plan","path":"plan/roadmap.md","required":true,"sha256":"53313e8cb5128d672c57bce68160d206ee7c8824ef733a6bbe3fa8136e3bec88","size":35},{"contentSchemaRef":null,"context":{"layer":"role","retention":"project","roleIds":["pm"],"workspaceAccess":"none"},"declaredOwnerRoleId":"pm","format":"text","kind":"plan","path":"plan/.env.example","required":false,"sha256":"517a25c25f2867975aeae18410d5f8aea5b3ccb479360016fb3c36e00bafe244","size":25},{"contentSchemaRef":null,"context":{"layer":"persistent","retention":"run","roleIds":["architect"],"workspaceAccess":"workspace_write"},"declaredOwnerRoleId":"pm","format":"text","kind":"design","path":"design/notes.txt","required":true,"sha256":"e32d114b6db46abc5dd006a592fb3726a013324d79fc9b3c208ffe2bb70d925a","size":33}],"projectId":"golden-brief","roles":[{"displayName":"Architect","roleId":"architect"},{"displayName":"PM","roleId":"pm"}],"schemaVersion":"agenttalk.brief.manifest.v1","title":"Golden Brief"}